{
  "profile": "codex-multitask-capability-contract",
  "schema_version": "0.1-draft",
  "snapshot_id": "capability:windows-local:2026-08-12:pilot-01",
  "captured_at": "2026-08-12T09:49:24.3814326Z",
  "scope": {
    "project": "Codex 多任务工程系统",
    "platform": "Codex",
    "claim_boundary": "Current Windows behavior pilot with three persisted Codex sessions in two manually bounded lab worktrees. CLI cwd binding, idle direct message, completed-session wait/cursor, and idle same-directory fork were exercised. Desktop managed-worktree creation, worktree fork, handoff, archive, subagent, active-turn, dirty-state, restart, ordering, and reliability behavior remain untested."
  },
  "environment": {
    "os": {
      "description": "Microsoft Windows 10.0.26200",
      "architecture": "X64"
    },
    "shell": {
      "name": "Windows PowerShell",
      "version": "5.1.26100.8875",
      "edition": "Desktop"
    },
    "codex": {
      "app": {
        "package_name": "OpenAI.Codex",
        "version": "26.803.10989.0",
        "architecture": "X64"
      },
      "cli": {
        "version": "codex-cli 0.146.0",
        "path": "%APPDATA%\\npm\\codex.ps1"
      },
      "relevant_feature_flags": [
        { "name": "artifact", "stage": "under development", "enabled": false },
        { "name": "goals", "stage": "stable", "enabled": true },
        { "name": "multi_agent", "stage": "stable", "enabled": true },
        { "name": "multi_agent_v2", "stage": "stable", "enabled": false },
        { "name": "plugins", "stage": "stable", "enabled": true },
        { "name": "skill_search", "stage": "stable", "enabled": true }
      ]
    },
    "git": {
      "version": "git version 2.44.0.windows.1",
      "core_autocrlf": "true"
    },
    "repository": {
      "path": "D:\\Desktop\\Codex多任务工程系统",
      "branch": "main",
      "head": "35bec9534eee779fcb9943232a43c8245a4cbc17",
      "status": "dirty",
      "dirty_paths": [
        ".gitignore",
        "README.md",
        "docs/00-project-charter.md",
        "docs/01-conceptual-model.md",
        "docs/02-worker-taxonomy.md",
        "docs/05-thread-and-worktree-mechanics.md",
        "docs/10-skill-suite-architecture.md",
        "docs/12-evaluation-roadmap.md",
        "docs/13-decisions.md",
        "docs/14-open-questions.md",
        "docs/15-conversation-record.md",
        "docs/16-project-status.md",
        "docs/17-glossary.md",
        "docs/18-capability-contract.md",
        "docs/README.md",
        "docs/research/capability-experiment-plan.md",
        "docs/research/capability-pilot-2026-08-12.md",
        "docs/research/official-sources.md",
        "docs/research/prior-art-and-capability-limits.md",
        "evidence/capabilities/2026-08-11-windows-local-preflight.json",
        "evidence/capabilities/2026-08-12-windows-local-pilot.json",
        "schemas/capability-contract.schema.json",
        "scripts/probe-codex-capabilities.ps1",
        "scripts/validate-capability-contract.py"
      ],
      "preexisting_changes_preserved": true
    }
  },
  "evidence": [
    {
      "evidence_id": "evidence:local-environment:2026-08-11",
      "kind": "local_command",
      "relation": "supports",
      "captured_at": "2026-08-11T14:46:47.3572530Z",
      "locator": "powershell.exe read-only version/AppX/Git probe; reproducible with scripts/probe-codex-capabilities.ps1",
      "result": {
        "app_package": "OpenAI.Codex 26.803.10989.0 X64",
        "cli": "codex-cli 0.146.0",
        "os": "Microsoft Windows 10.0.26200 X64",
        "powershell": "5.1.26100.8875 Desktop",
        "git": "2.44.0.windows.1",
        "repository": "main@35bec9534eee779fcb9943232a43c8245a4cbc17 dirty"
      },
      "conditions": ["Local host", "Windows AppX installation", "Repository path fixed in this snapshot"],
      "limitations": ["Does not inspect UI behavior", "Does not capture tool schema", "The user-home portion of the CLI path is normalized", "Dirty paths belong to the ongoing documentation work and were not modified by the probe"],
      "confidence": {
        "source_quality": "high",
        "directness": "direct",
        "reproducibility": "high",
        "applicability": "current-local"
      }
    },
    {
      "evidence_id": "evidence:cli-features:2026-08-11",
      "kind": "local_command",
      "relation": "supports",
      "captured_at": "2026-08-11T14:48:00Z",
      "locator": "codex features list",
      "result": {
        "multi_agent": { "stage": "stable", "enabled": true },
        "multi_agent_v2": { "stage": "stable", "enabled": false },
        "artifact": { "stage": "under development", "enabled": false }
      },
      "conditions": ["codex-cli 0.146.0", "Current user configuration as resolved by the CLI"],
      "limitations": ["Feature stage and enablement do not specify create/fork/message/handoff behavior", "No subagent was spawned"],
      "confidence": {
        "source_quality": "high",
        "directness": "direct",
        "reproducibility": "high",
        "applicability": "current-local"
      }
    },
    {
      "evidence_id": "evidence:desktop-task-tool-schema:2026-08-11",
      "kind": "tool_schema",
      "relation": "supports",
      "captured_at": "2026-08-11T14:50:00Z",
      "locator": "Current Codex Desktop tool declarations for create_thread, fork_thread, list_threads, read_thread, wait_threads, send_message_to_thread, handoff_thread, get_handoff_status, set_thread_archived, set_thread_pinned, and set_thread_title",
      "result": {
        "create": "Explicit user request required; Git projects default to worktree; optional existing branch or working-tree starting state",
        "fork": "Same-directory or worktree; completed history only",
        "message": "Background follow-up to an existing task",
        "wait": "Wait for first completion/input-required among up to eight targets; cursor suppresses delivered final",
        "handoff": "Move another task and associated Git state between checkout and Codex worktree; calling task cannot move itself",
        "archive": "Archive or unarchive a task in the background"
      },
      "conditions": ["Codex Desktop session", "Local host is available", "Tool declarations visible to this task"],
      "limitations": ["Schema is a declaration, not a behavior run", "Return object details and failure cases are not fully specified", "Tool declarations may change independently of App/CLI versions"],
      "confidence": {
        "source_quality": "high",
        "directness": "direct",
        "reproducibility": "medium",
        "applicability": "current-local"
      }
    },
    {
      "evidence_id": "evidence:session-subagent-schema:2026-08-11",
      "kind": "tool_schema",
      "relation": "supports",
      "captured_at": "2026-08-11T14:50:00Z",
      "locator": "Current session collaboration declarations for spawn_agent, followup_task, send_message, interrupt_agent, list_agents, and wait_agent",
      "result": {
        "available_operations": ["spawn", "follow-up", "message", "interrupt", "list", "wait"],
        "session_concurrency_slots": 4,
        "workspace_declaration": "Agents share the same filesystem and current working directory"
      },
      "conditions": ["Current primary task", "Current collaboration mode and developer policy"],
      "limitations": ["No subagent behavior was executed", "Availability and policy are session-scoped", "Shared filesystem does not prove safe concurrent writes"],
      "confidence": {
        "source_quality": "high",
        "directness": "direct",
        "reproducibility": "medium",
        "applicability": "current-local"
      }
    },
    {
      "evidence_id": "evidence:historical-message-smoke:2026-08-09",
      "kind": "historical_experiment",
      "relation": "qualifies",
      "captured_at": "2026-08-09T00:00:00Z",
      "locator": "docs/12-evaluation-roadmap.md#已完成的最小通信实验",
      "result": {
        "outcome": "A bounded shared-directory direct-message loop completed after independent acceptance",
        "fixture": "UTF-8 text statistics CLI",
        "final_exit_code": 0
      },
      "conditions": ["Earlier Codex task environment", "Windows PowerShell 5.1", "Explicit file ownership"],
      "limitations": ["Not captured under the current App/CLI snapshot", "No token, model-tier, lifecycle, fault-injection, or context-decay comparison", "Cannot establish current message reliability"],
      "confidence": {
        "source_quality": "medium",
        "directness": "direct",
        "reproducibility": "medium",
        "applicability": "historical-local"
      }
    },
    {
      "evidence_id": "evidence:task-inspection-pilot:2026-08-11",
      "kind": "behavior_run",
      "relation": "supports",
      "captured_at": "2026-08-11T15:00:15.7990333Z",
      "locator": "Read-only current-session calls: list_threads(limit=10), read_thread(current project task, turnLimit=1, includeOutputs=false), and read_thread(nonexistent UUID)",
      "result": {
        "current_task": {
          "thread_id": "normalized:current-project-task",
          "host_id": "local",
          "backing_kind": "codex",
          "list_status": "active"
        },
        "valid_read": {
          "status": "active",
          "returned_turns": 1,
          "content_output": "not recorded"
        },
        "invalid_read": {
          "target": "00000000-0000-0000-0000-000000000000",
          "outcome": "explicit not-found error"
        }
      },
      "conditions": ["Current project task was active", "Local host", "No tool outputs or other task conversation content were requested or persisted"],
      "limitations": ["Only one current task and one invalid ID were tested", "Does not test pagination, stale host IDs, archived tasks, wait, message, or persistence", "Task titles and summaries are untrusted and were not used as instructions"],
      "confidence": {
        "source_quality": "high",
        "directness": "direct",